{"contentDigest":"d102def277a1b75ef86a65c56d7340ba6c9eed8800a60f3d2104d9a3fc72ad14","decision":"approve","execution":{"arch":"n/a","evidence":"unproven","os":null},"id":"composition-patterns","notes":{"en":"Platform-metadata release only. The 1.0.1 archive is byte-identical to the reviewed 1.0.0 archive except the floe.json fields version (1.0.0 -> 1.0.1) and platforms ([ios] -> [ios, linux]), declaring the Linux compatibility environment of the Android shared skill runtime for unchanged guide content. Old archive sha256 c322f1bfa73011ffab4b989d6b47c229603ff3a11afebb063a8d5f02c929cd00 / contentDigest 9e4ca9c6b255e9c992fce77452254496736c0fb3691fe7dda8fa7c38d33294a3; new archive sha256 95810c28a5b4b84d867fff1c9f536f0d51ecddc5e165567854056ee7a5bb8fe9 / contentDigest d102def277a1b75ef86a65c56d7340ba6c9eed8800a60f3d2104d9a3fc72ad14. Instructions, assets, licenses, capabilities, tools and dependencies are unchanged; the standing signed 1.0.0 static-content review remains the content review of record. This machine record is a platform declaration check only: not guest-verified, no execution claim, not full-App acceptance.","zh-Hans":"仅为平台元数据发布：1.0.1 归档与已评审的 1.0.0 归档逐字节一致，唯一差异是 floe.json 的 version（1.0.0 -> 1.0.1）与 platforms（[ios] -> [ios, linux]），用于让未改动的指南内容声明 Android 共享技能运行时所用的 Linux 兼容环境。旧归档 sha256 c322f1bfa73011ffab4b989d6b47c229603ff3a11afebb063a8d5f02c929cd00 / contentDigest 9e4ca9c6b255e9c992fce77452254496736c0fb3691fe7dda8fa7c38d33294a3；新归档 sha256 95810c28a5b4b84d867fff1c9f536f0d51ecddc5e165567854056ee7a5bb8fe9 / contentDigest d102def277a1b75ef86a65c56d7340ba6c9eed8800a60f3d2104d9a3fc72ad14。指导内容、素材、许可、能力、工具与依赖均未变化；对有符号名 1.0.0 静态内容评审仍是内容评审记录。本机器记录仅校验平台声明：非来宾验证、无执行声明，也不是完整 App 验收。"},"packageSha256":"95810c28a5b4b84d867fff1c9f536f0d51ecddc5e165567854056ee7a5bb8fe9","reviewStage":"static-content-reviewed","reviewedAt":"2026-10-28","reviewedCapabilities":["workspace.read"],"reviewedPythonPackages":[],"reviewedTools":[],"reviewer":"Floe Skill Hub static-compat (machine)","schemaVersion":1,"version":"1.0.1"}