{"contentDigest":"35b2008714c21bbbf7fb9c234358d0d47fe0d2facd86ce94a446b66fbc3f6f2f","decision":"approve","execution":{"arch":"n/a","evidence":"unproven","os":null},"id":"ux-researcher-designer","notes":{"en":"Static content, retained asset/license notices and declared capability/tool bindings reviewed. No package-managed scripts/ runtime entrypoint; any reference code remains subject to the task existing Linux execution policy. This is content review, not guest execution or full-App acceptance.","zh-Hans":"已复核静态内容、素材与许可声明及能力／工具绑定；没有包管理的 scripts/ 运行入口，参考代码仍受任务现有 Linux 执行策略约束。此为内容审核，不是来宾执行或完整 App 验收。"},"packageSha256":"45f92a17e660d04d7c0b9d9008c436bfd9f642dc42176d83d74642ead000b2b2","reviewStage":"static-content-reviewed","reviewedAt":"2026-10-26","reviewedCapabilities":["workspace.read","workspace.write"],"reviewedPythonPackages":[],"reviewedTools":[],"reviewer":"Floe Skill Hub curation","schemaVersion":1,"version":"1.0.0"}