{"contentDigest":"33c01937f5257735ef2bcf967f890a572816e6829574969a2715def2ce8b9a73","decision":"approve","execution":{"arch":"n/a","evidence":"unproven","os":null},"id":"writing-guidelines","notes":{"en":"Platform-metadata release only. The 1.0.1 archive is byte-identical to the reviewed 1.0.0 archive except the floe.json fields version (1.0.0 -> 1.0.1) and platforms ([ios] -> [ios, linux]), declaring the Linux compatibility environment of the Android shared skill runtime for unchanged guide content. Old archive sha256 2a4a27918cc640302c8e6c6aef80047208d8e166d1ef7249b5e7d6f76e4b8e5c / contentDigest 1ce612756ea9d2e88525950f930a8927675d0ea7e1db413ec6134aff8777c20d; new archive sha256 9187354a3660a577c358e8b48cd0df2cabc78dacdf5070e56ad109db5e34ef34 / contentDigest 33c01937f5257735ef2bcf967f890a572816e6829574969a2715def2ce8b9a73. Instructions, assets, licenses, capabilities, tools and dependencies are unchanged; the standing signed 1.0.0 static-content review remains the content review of record. This machine record is a platform declaration check only: not guest-verified, no execution claim, not full-App acceptance.","zh-Hans":"仅为平台元数据发布：1.0.1 归档与已评审的 1.0.0 归档逐字节一致，唯一差异是 floe.json 的 version（1.0.0 -> 1.0.1）与 platforms（[ios] -> [ios, linux]），用于让未改动的指南内容声明 Android 共享技能运行时所用的 Linux 兼容环境。旧归档 sha256 2a4a27918cc640302c8e6c6aef80047208d8e166d1ef7249b5e7d6f76e4b8e5c / contentDigest 1ce612756ea9d2e88525950f930a8927675d0ea7e1db413ec6134aff8777c20d；新归档 sha256 9187354a3660a577c358e8b48cd0df2cabc78dacdf5070e56ad109db5e34ef34 / contentDigest 33c01937f5257735ef2bcf967f890a572816e6829574969a2715def2ce8b9a73。指导内容、素材、许可、能力、工具与依赖均未变化；对有符号名 1.0.0 静态内容评审仍是内容评审记录。本机器记录仅校验平台声明：非来宾验证、无执行声明，也不是完整 App 验收。"},"packageSha256":"9187354a3660a577c358e8b48cd0df2cabc78dacdf5070e56ad109db5e34ef34","reviewStage":"static-content-reviewed","reviewedAt":"2026-10-28","reviewedCapabilities":["workspace.read"],"reviewedPythonPackages":[],"reviewedTools":[],"reviewer":"Floe Skill Hub static-compat (machine)","schemaVersion":1,"version":"1.0.1"}