{"contentDigest":"7df72731b68e909d49b2813d0e7250fb67bfa7947881c394367cb30f45065da0","decision":"approve","execution":{"arch":"n/a","evidence":"unproven","os":null},"id":"web-design-guidelines","notes":{"en":"Platform-metadata release only. The 1.0.1 archive is byte-identical to the reviewed 1.0.0 archive except the floe.json fields version (1.0.0 -> 1.0.1) and platforms ([ios] -> [ios, linux]), declaring the Linux compatibility environment of the Android shared skill runtime for unchanged guide content. Old archive sha256 421ac76bea0fda9562d4704875e2d7dd5bfcc5bbe676f5dab183dd8273707048 / contentDigest c6674ab9218111637d2092cc4c2b147b250b89920324bea4fcb43d1c75408bb2; new archive sha256 ad92f7a6013fba77e8cbfcd559d80d60fe8ec231111e8c23468ee2a1f1803155 / contentDigest 7df72731b68e909d49b2813d0e7250fb67bfa7947881c394367cb30f45065da0. Instructions, assets, licenses, capabilities, tools and dependencies are unchanged; the standing signed 1.0.0 static-content review remains the content review of record. This machine record is a platform declaration check only: not guest-verified, no execution claim, not full-App acceptance.","zh-Hans":"仅为平台元数据发布：1.0.1 归档与已评审的 1.0.0 归档逐字节一致，唯一差异是 floe.json 的 version（1.0.0 -> 1.0.1）与 platforms（[ios] -> [ios, linux]），用于让未改动的指南内容声明 Android 共享技能运行时所用的 Linux 兼容环境。旧归档 sha256 421ac76bea0fda9562d4704875e2d7dd5bfcc5bbe676f5dab183dd8273707048 / contentDigest c6674ab9218111637d2092cc4c2b147b250b89920324bea4fcb43d1c75408bb2；新归档 sha256 ad92f7a6013fba77e8cbfcd559d80d60fe8ec231111e8c23468ee2a1f1803155 / contentDigest 7df72731b68e909d49b2813d0e7250fb67bfa7947881c394367cb30f45065da0。指导内容、素材、许可、能力、工具与依赖均未变化；对有符号名 1.0.0 静态内容评审仍是内容评审记录。本机器记录仅校验平台声明：非来宾验证、无执行声明，也不是完整 App 验收。"},"packageSha256":"ad92f7a6013fba77e8cbfcd559d80d60fe8ec231111e8c23468ee2a1f1803155","reviewStage":"static-content-reviewed","reviewedAt":"2026-10-28","reviewedCapabilities":["workspace.read"],"reviewedPythonPackages":[],"reviewedTools":[],"reviewer":"Floe Skill Hub static-compat (machine)","schemaVersion":1,"version":"1.0.1"}