{"contentDigest":"5742e9207d3060b04bab8627fa9c1c0d697e9724a5a3398ca6556263c07c9cc4","decision":"approve","execution":{"arch":"n/a","evidence":"unproven","os":null},"id":"scientific-critical-thinking","notes":{"en":"Static content, retained asset/license notices and declared capability/tool bindings reviewed. No package-managed scripts/ runtime entrypoint; any reference code remains subject to the task existing Linux execution policy. This is content review, not guest execution or full-App acceptance.","zh-Hans":"已复核静态内容、素材与许可声明及能力／工具绑定；没有包管理的 scripts/ 运行入口，参考代码仍受任务现有 Linux 执行策略约束。此为内容审核，不是来宾执行或完整 App 验收。"},"packageSha256":"2455d9e98183658bb3412e509000bac870304512ba49bd01577d57416c5789d3","reviewStage":"static-content-reviewed","reviewedAt":"2026-10-26","reviewedCapabilities":["workspace.read"],"reviewedPythonPackages":[],"reviewedTools":[],"reviewer":"Floe Skill Hub curation","schemaVersion":1,"version":"1.0.0"}