{"contentDigest":"1525844190380882dcbeab9c3dfdf06a0bf4ce5a78e6f0753e860f09e1e69677","decision":"approve","execution":{"arch":"n/a","evidence":"unproven","os":null},"id":"floe-office","notes":{"en":"Static content, retained asset/license notices and declared capability/tool bindings reviewed. No package-managed scripts/ runtime entrypoint; any reference code remains subject to the task existing Linux execution policy. This is content review, not guest execution or full-App acceptance.","zh-Hans":"已复核静态内容、素材与许可声明及能力／工具绑定；没有包管理的 scripts/ 运行入口，参考代码仍受任务现有 Linux 执行策略约束。此为内容审核，不是来宾执行或完整 App 验收。"},"packageSha256":"9fec7792f143805dc92ae60320a2a70f0ed256ecea0f55656ff567aac0b40ecc","reviewStage":"static-content-reviewed","reviewedAt":"2026-10-26","reviewedCapabilities":[],"reviewedPythonPackages":[],"reviewedTools":[],"reviewer":"Floe Skill Hub curation","schemaVersion":1,"version":"1.5.0"}