{"contentDigest":"d47c35d23355c450af0e8514c17c234d56d16d9ff887d17698eaa97eed0045c9","decision":"approve","execution":{"arch":"riscv64","evidence":"unproven","os":"linux"},"id":"algorithmic-art","notes":{"en":"Static content review only. SKILL.md, bundled scripts (python3 stdlib generate_art.py and the node prng_parity.js parity check), inlined core JS and license notices reviewed against the manifest: declared capabilities execution.remote/workspace.read/workspace.write and required tool exec.shell match shipped content; no python dependencies declared and none imported; the HTML artifact is fully self-contained with zero CDN/external requests and no network; app-surface preview uses the existing localService/browser grants. No self-granted trust, no unlisted-skill fetch, no install-time privilege. Guest execution remains UNPROVEN (Main-owned); this is not runtime qualification or App acceptance.","zh-Hans":"仅静态内容审核。已按清单核对 SKILL.md、随附脚本（python3 stdlib generate_art.py 与 node prng_parity.js 一致性校验）、内联核心 JS 与许可声明：声明能力 execution.remote/workspace.read/workspace.write 与必需工具 exec.shell 和实际内容一致；未声明也未导入任何 python 依赖；HTML 产物完全自包含，零 CDN/外部请求、无网络；应用侧预览使用现有 localService/browser 授权。无自我授权信任、无拉取未列名 Skill、无安装时特权。来宾执行仍为未证实（Main 负责）；此非运行时鉴定或 App 验收。"},"packageSha256":"0db4c668d6adb238a3f38789af14066dc4c447e5957a17dd254bc3d3a3dc346a","reviewStage":"static-content-reviewed","reviewedAt":"2026-10-26","reviewedCapabilities":["execution.remote","workspace.read","workspace.write"],"reviewedPythonPackages":[],"reviewedTools":["exec.shell"],"reviewer":"Floe Skill Hub curation","schemaVersion":1,"version":"1.0.0"}