{"contentDigest":"c1c1c8cc5bb0f0cdff41b13c1040f17c1506a2c46f936c96cd8a9f2c66d31d95","decision":"approve","execution":{"arch":"n/a","evidence":"unproven","os":null},"id":"requesting-code-review","notes":{"en":"Platform-metadata release only. The 1.0.1 archive is byte-identical to the reviewed 1.0.0 archive except the floe.json fields version (1.0.0 -> 1.0.1) and platforms ([ios] -> [ios, linux]), declaring the Linux compatibility environment of the Android shared skill runtime for unchanged guide content. Old archive sha256 7f7e15b2c88361a9dd7bfd03a6b386eff6391652a22e9328b2c2fd64b365d17d / contentDigest 25acc1e765bbba9f201140325128eb1cfd86c87f33a6ae3b6af3d527b64bc1c6; new archive sha256 f18730676290da8ee3ed279dd6042ca9f4fd5ea874be3737dbf8c01d2c0e101b / contentDigest c1c1c8cc5bb0f0cdff41b13c1040f17c1506a2c46f936c96cd8a9f2c66d31d95. Instructions, assets, licenses, capabilities, tools and dependencies are unchanged; the standing signed 1.0.0 static-content review remains the content review of record. This machine record is a platform declaration check only: not guest-verified, no execution claim, not full-App acceptance.","zh-Hans":"仅为平台元数据发布：1.0.1 归档与已评审的 1.0.0 归档逐字节一致，唯一差异是 floe.json 的 version（1.0.0 -> 1.0.1）与 platforms（[ios] -> [ios, linux]），用于让未改动的指南内容声明 Android 共享技能运行时所用的 Linux 兼容环境。旧归档 sha256 7f7e15b2c88361a9dd7bfd03a6b386eff6391652a22e9328b2c2fd64b365d17d / contentDigest 25acc1e765bbba9f201140325128eb1cfd86c87f33a6ae3b6af3d527b64bc1c6；新归档 sha256 f18730676290da8ee3ed279dd6042ca9f4fd5ea874be3737dbf8c01d2c0e101b / contentDigest c1c1c8cc5bb0f0cdff41b13c1040f17c1506a2c46f936c96cd8a9f2c66d31d95。指导内容、素材、许可、能力、工具与依赖均未变化；对有符号名 1.0.0 静态内容评审仍是内容评审记录。本机器记录仅校验平台声明：非来宾验证、无执行声明，也不是完整 App 验收。"},"packageSha256":"f18730676290da8ee3ed279dd6042ca9f4fd5ea874be3737dbf8c01d2c0e101b","reviewStage":"static-content-reviewed","reviewedAt":"2026-10-28","reviewedCapabilities":["workspace.read"],"reviewedPythonPackages":[],"reviewedTools":[],"reviewer":"Floe Skill Hub static-compat (machine)","schemaVersion":1,"version":"1.0.1"}