{"contentDigest":"d06864b9ef0b54ef2fc0007b3ea4d08f5396b9975d04ede00941d9c760537618","decision":"approve","execution":{"arch":"n/a","evidence":"unproven","os":null},"id":"a11y-audit","notes":{"en":"Platform-metadata release only. The 1.0.1 archive is byte-identical to the reviewed 1.0.0 archive except the floe.json fields version (1.0.0 -> 1.0.1) and platforms ([ios] -> [ios, linux]), declaring the Linux compatibility environment of the Android shared skill runtime for unchanged guide content. Old archive sha256 df4cf27dc4905c8dd0356ffba5a61f3442ce9492507fb631dbeb15a05432a49a / contentDigest d1fbbade9f43f0982867e67fa89dcda74bdf5bc7831731b93aa458986ee42ddd; new archive sha256 6a62a33adbc67e2605f72b524fba46bdb69ebd2ee42bd1c19c7e4138fd0085cd / contentDigest d06864b9ef0b54ef2fc0007b3ea4d08f5396b9975d04ede00941d9c760537618. Instructions, assets, licenses, capabilities, tools and dependencies are unchanged; the standing signed 1.0.0 static-content review remains the content review of record. This machine record is a platform declaration check only: not guest-verified, no execution claim, not full-App acceptance.","zh-Hans":"仅为平台元数据发布：1.0.1 归档与已评审的 1.0.0 归档逐字节一致，唯一差异是 floe.json 的 version（1.0.0 -> 1.0.1）与 platforms（[ios] -> [ios, linux]），用于让未改动的指南内容声明 Android 共享技能运行时所用的 Linux 兼容环境。旧归档 sha256 df4cf27dc4905c8dd0356ffba5a61f3442ce9492507fb631dbeb15a05432a49a / contentDigest d1fbbade9f43f0982867e67fa89dcda74bdf5bc7831731b93aa458986ee42ddd；新归档 sha256 6a62a33adbc67e2605f72b524fba46bdb69ebd2ee42bd1c19c7e4138fd0085cd / contentDigest d06864b9ef0b54ef2fc0007b3ea4d08f5396b9975d04ede00941d9c760537618。指导内容、素材、许可、能力、工具与依赖均未变化；对有符号名 1.0.0 静态内容评审仍是内容评审记录。本机器记录仅校验平台声明：非来宾验证、无执行声明，也不是完整 App 验收。"},"packageSha256":"6a62a33adbc67e2605f72b524fba46bdb69ebd2ee42bd1c19c7e4138fd0085cd","reviewStage":"static-content-reviewed","reviewedAt":"2026-10-28","reviewedCapabilities":["browser.observe","workspace.read"],"reviewedPythonPackages":[],"reviewedTools":[],"reviewer":"Floe Skill Hub static-compat (machine)","schemaVersion":1,"version":"1.0.1"}