{"contentDigest":"268b9bd7e96092e643970bc3b13a085061f84fab71b87dea620fcb4303619838","decision":"approve","execution":{"arch":"n/a","evidence":"unproven","os":null},"id":"deepread","notes":{"en":"Platform-metadata release only. The 1.0.1 archive is byte-identical to the reviewed 1.0.0 archive except the floe.json fields version (1.0.0 -> 1.0.1) and platforms ([ios] -> [ios, linux]), declaring the Linux compatibility environment of the Android shared skill runtime for unchanged guide content. Old archive sha256 51f7b13bb48047eff85d13ccad6c145ffea457990de4e4b96765776ea93efb91 / contentDigest 0a5c3334e8b074def6b407b37b195c62c276278c71898e26a1f75655104523a2; new archive sha256 bba4e34f3959f152e7d5c615f8d264120b22f797f02b41db266f033095d020a3 / contentDigest 268b9bd7e96092e643970bc3b13a085061f84fab71b87dea620fcb4303619838. Instructions, assets, licenses, capabilities, tools and dependencies are unchanged; the standing signed 1.0.0 static-content review remains the content review of record. This machine record is a platform declaration check only: not guest-verified, no execution claim, not full-App acceptance.","zh-Hans":"仅为平台元数据发布：1.0.1 归档与已评审的 1.0.0 归档逐字节一致，唯一差异是 floe.json 的 version（1.0.0 -> 1.0.1）与 platforms（[ios] -> [ios, linux]），用于让未改动的指南内容声明 Android 共享技能运行时所用的 Linux 兼容环境。旧归档 sha256 51f7b13bb48047eff85d13ccad6c145ffea457990de4e4b96765776ea93efb91 / contentDigest 0a5c3334e8b074def6b407b37b195c62c276278c71898e26a1f75655104523a2；新归档 sha256 bba4e34f3959f152e7d5c615f8d264120b22f797f02b41db266f033095d020a3 / contentDigest 268b9bd7e96092e643970bc3b13a085061f84fab71b87dea620fcb4303619838。指导内容、素材、许可、能力、工具与依赖均未变化；对有符号名 1.0.0 静态内容评审仍是内容评审记录。本机器记录仅校验平台声明：非来宾验证、无执行声明，也不是完整 App 验收。"},"packageSha256":"bba4e34f3959f152e7d5c615f8d264120b22f797f02b41db266f033095d020a3","reviewStage":"static-content-reviewed","reviewedAt":"2026-10-28","reviewedCapabilities":["workspace.read","workspace.write"],"reviewedPythonPackages":[],"reviewedTools":[],"reviewer":"Floe Skill Hub static-compat (machine)","schemaVersion":1,"version":"1.0.1"}