{"contentDigest":"a6d8882a59ba769d374a85c90cbd534861e6fa75437a811ba476dff3f149d238","decision":"approve","execution":{"arch":"n/a","evidence":"unproven","os":null},"id":"ux-researcher-designer","notes":{"en":"Platform-metadata release only. The 1.0.1 archive is byte-identical to the reviewed 1.0.0 archive except the floe.json fields version (1.0.0 -> 1.0.1) and platforms ([ios] -> [ios, linux]), declaring the Linux compatibility environment of the Android shared skill runtime for unchanged guide content. Old archive sha256 45f92a17e660d04d7c0b9d9008c436bfd9f642dc42176d83d74642ead000b2b2 / contentDigest 35b2008714c21bbbf7fb9c234358d0d47fe0d2facd86ce94a446b66fbc3f6f2f; new archive sha256 488ce8a13208ce92077a042fdb1d24741db0b112cc1b6aecb78b5b4a5c660466 / contentDigest a6d8882a59ba769d374a85c90cbd534861e6fa75437a811ba476dff3f149d238. Instructions, assets, licenses, capabilities, tools and dependencies are unchanged; the standing signed 1.0.0 static-content review remains the content review of record. This machine record is a platform declaration check only: not guest-verified, no execution claim, not full-App acceptance.","zh-Hans":"仅为平台元数据发布：1.0.1 归档与已评审的 1.0.0 归档逐字节一致，唯一差异是 floe.json 的 version（1.0.0 -> 1.0.1）与 platforms（[ios] -> [ios, linux]），用于让未改动的指南内容声明 Android 共享技能运行时所用的 Linux 兼容环境。旧归档 sha256 45f92a17e660d04d7c0b9d9008c436bfd9f642dc42176d83d74642ead000b2b2 / contentDigest 35b2008714c21bbbf7fb9c234358d0d47fe0d2facd86ce94a446b66fbc3f6f2f；新归档 sha256 488ce8a13208ce92077a042fdb1d24741db0b112cc1b6aecb78b5b4a5c660466 / contentDigest a6d8882a59ba769d374a85c90cbd534861e6fa75437a811ba476dff3f149d238。指导内容、素材、许可、能力、工具与依赖均未变化；对有符号名 1.0.0 静态内容评审仍是内容评审记录。本机器记录仅校验平台声明：非来宾验证、无执行声明，也不是完整 App 验收。"},"packageSha256":"488ce8a13208ce92077a042fdb1d24741db0b112cc1b6aecb78b5b4a5c660466","reviewStage":"static-content-reviewed","reviewedAt":"2026-10-28","reviewedCapabilities":["workspace.read","workspace.write"],"reviewedPythonPackages":[],"reviewedTools":[],"reviewer":"Floe Skill Hub static-compat (machine)","schemaVersion":1,"version":"1.0.1"}