{"contentDigest":"10ddf634c18097726666cc87c4864176738b31dce4f25a9ef90b9432ee1beef0","decision":"approve","execution":{"arch":"n/a","evidence":"unproven","os":null},"id":"social-content","notes":{"en":"Platform-metadata release only. The 1.0.1 archive is byte-identical to the reviewed 1.0.0 archive except the floe.json fields version (1.0.0 -> 1.0.1) and platforms ([ios] -> [ios, linux]), declaring the Linux compatibility environment of the Android shared skill runtime for unchanged guide content. Old archive sha256 ef59a6f10c51b98747eeab7329bae33fb45779a78313b4202e2516052212a37d / contentDigest 482ea301590827730d4682d640bc1d80321eb6988083b48073d3fdef26bec37c; new archive sha256 dac4552e227cf4663f91d3c0cd78d5969b4b3fd9aefe63255acd82fe7dcf9660 / contentDigest 10ddf634c18097726666cc87c4864176738b31dce4f25a9ef90b9432ee1beef0. Instructions, assets, licenses, capabilities, tools and dependencies are unchanged; the standing signed 1.0.0 static-content review remains the content review of record. This machine record is a platform declaration check only: not guest-verified, no execution claim, not full-App acceptance.","zh-Hans":"仅为平台元数据发布：1.0.1 归档与已评审的 1.0.0 归档逐字节一致，唯一差异是 floe.json 的 version（1.0.0 -> 1.0.1）与 platforms（[ios] -> [ios, linux]），用于让未改动的指南内容声明 Android 共享技能运行时所用的 Linux 兼容环境。旧归档 sha256 ef59a6f10c51b98747eeab7329bae33fb45779a78313b4202e2516052212a37d / contentDigest 482ea301590827730d4682d640bc1d80321eb6988083b48073d3fdef26bec37c；新归档 sha256 dac4552e227cf4663f91d3c0cd78d5969b4b3fd9aefe63255acd82fe7dcf9660 / contentDigest 10ddf634c18097726666cc87c4864176738b31dce4f25a9ef90b9432ee1beef0。指导内容、素材、许可、能力、工具与依赖均未变化；对有符号名 1.0.0 静态内容评审仍是内容评审记录。本机器记录仅校验平台声明：非来宾验证、无执行声明，也不是完整 App 验收。"},"packageSha256":"dac4552e227cf4663f91d3c0cd78d5969b4b3fd9aefe63255acd82fe7dcf9660","reviewStage":"static-content-reviewed","reviewedAt":"2026-10-28","reviewedCapabilities":["workspace.read","workspace.write"],"reviewedPythonPackages":[],"reviewedTools":[],"reviewer":"Floe Skill Hub static-compat (machine)","schemaVersion":1,"version":"1.0.1"}