{"contentDigest":"173b124ffb1e3dcfad8689bb089ef3c081398c7d90aeeb23558fda109631e0db","decision":"approve","execution":{"arch":"riscv64","evidence":"guest-verified","os":"linux"},"id":"sympy","notes":{"en":"Static permissions review retained. Real App-owned Linux/riscv64 guest qualification passed in iOS Simulator, App source 68f87693fb8d5b5ebb7b5f67c04c55096546809d: seven hash-locked offline wheels; eight symbolic checks and SymPy1.14.0, empty failures, output JSON SHA verified; owned environment prefix cleaned. Full test1/1 PASS,0skip. This establishes these shipped script workflows, not model invocation, all App UI or physical-device acceptance.","zh-Hans":"保留静态权限审核结论。已在iOS模拟器内通过真实App所属Linux/riscv64客体资格验证，App源码68f87693fb8d5b5ebb7b5f67c04c55096546809d：七个哈希锁定离线wheel；八项符号计算、SymPy1.14.0、空失败列表及产物JSON摘要核对通过；所属环境目录已清理。完整用例1/1通过、零跳过。本记录证明所附脚本流程，不代表模型调用、全App界面或物理设备验收。"},"packageSha256":"a8a419553d6bd2e7e537dcc35a2e157b03fd618ce29b0571521f932ff52f5574","reviewStage":"guest-execution-qualified","reviewedAt":"2026-10-26","reviewedCapabilities":["execution.remote","workspace.read","workspace.write"],"reviewedPythonPackages":[{"capabilities":["math.symbolic"],"purpose":"symbolic mathematics engine required by every example in this guide","spec":"sympy==1.14.0"},{"capabilities":["math.numeric-core"],"purpose":"arbitrary-precision backend pinned inside SymPy 1.14's required >=1.1,<1.4 range","spec":"mpmath==1.3.0"}],"reviewedTools":["exec.shell"],"reviewer":"Floe Skill Hub curation","schemaVersion":1,"version":"1.0.0"}