{"contentDigest":"68a3d6dc57c7075f2309141a7ce56ddab69d0a76b11fd2f8691a06cc4f1d57d1","decision":"approve","execution":{"arch":"n/a","evidence":"unproven","os":null},"id":"doc-coauthoring","notes":{"en":"Platform-metadata release only. The 1.0.1 archive is byte-identical to the reviewed 1.0.0 archive except the floe.json fields version (1.0.0 -> 1.0.1) and platforms ([ios] -> [ios, linux]), declaring the Linux compatibility environment of the Android shared skill runtime for unchanged guide content. Old archive sha256 c90171f6830b79d99bb0126dfe0f6790f7e8d76392644584a256d266599995ae / contentDigest c178ab41650ac4c9b94020f1c6738ec39c66c78e75d9388798c2bcaccc21b24f; new archive sha256 7474a6cfc85b19bdcbd0d11e0bdf8ee70be0a34ac63276ea1023b2b438349eb9 / contentDigest 68a3d6dc57c7075f2309141a7ce56ddab69d0a76b11fd2f8691a06cc4f1d57d1. Instructions, assets, licenses, capabilities, tools and dependencies are unchanged; the standing signed 1.0.0 static-content review remains the content review of record. This machine record is a platform declaration check only: not guest-verified, no execution claim, not full-App acceptance.","zh-Hans":"仅为平台元数据发布：1.0.1 归档与已评审的 1.0.0 归档逐字节一致，唯一差异是 floe.json 的 version（1.0.0 -> 1.0.1）与 platforms（[ios] -> [ios, linux]），用于让未改动的指南内容声明 Android 共享技能运行时所用的 Linux 兼容环境。旧归档 sha256 c90171f6830b79d99bb0126dfe0f6790f7e8d76392644584a256d266599995ae / contentDigest c178ab41650ac4c9b94020f1c6738ec39c66c78e75d9388798c2bcaccc21b24f；新归档 sha256 7474a6cfc85b19bdcbd0d11e0bdf8ee70be0a34ac63276ea1023b2b438349eb9 / contentDigest 68a3d6dc57c7075f2309141a7ce56ddab69d0a76b11fd2f8691a06cc4f1d57d1。指导内容、素材、许可、能力、工具与依赖均未变化；对有符号名 1.0.0 静态内容评审仍是内容评审记录。本机器记录仅校验平台声明：非来宾验证、无执行声明，也不是完整 App 验收。"},"packageSha256":"7474a6cfc85b19bdcbd0d11e0bdf8ee70be0a34ac63276ea1023b2b438349eb9","reviewStage":"static-content-reviewed","reviewedAt":"2026-10-28","reviewedCapabilities":["workspace.read","workspace.write"],"reviewedPythonPackages":[],"reviewedTools":[],"reviewer":"Floe Skill Hub static-compat (machine)","schemaVersion":1,"version":"1.0.1"}