{"contentDigest":"0f38fa3a56c9ab6685efef4d5e8c4b819d9a84267d4047302469bbcb8ad899d2","decision":"approve","execution":{"arch":"n/a","evidence":"unproven","os":null},"id":"floe-file-organizer","notes":{"en":"Static content, retained asset/license notices and declared capability/tool bindings reviewed. No package-managed scripts/ runtime entrypoint; any reference code remains subject to the task existing Linux execution policy. This is content review, not guest execution or full-App acceptance.","zh-Hans":"已复核静态内容、素材与许可声明及能力／工具绑定；没有包管理的 scripts/ 运行入口，参考代码仍受任务现有 Linux 执行策略约束。此为内容审核，不是来宾执行或完整 App 验收。"},"packageSha256":"146e5e057b203d6ebfc8f289b514ab0b59a63670803d8e7e5d5915135e88f0b4","reviewStage":"static-content-reviewed","reviewedAt":"2026-10-26","reviewedCapabilities":["workspace.delete","workspace.read","workspace.write"],"reviewedPythonPackages":[],"reviewedTools":[],"reviewer":"Floe Skill Hub curation","schemaVersion":1,"version":"1.0.0"}