{"contentDigest":"639c1f39cad7bdefcfb6db6e9ae1266b53d468d244d9da3cee61e3d67b8b6bfe","decision":"approve","execution":{"arch":"n/a","evidence":"unproven","os":null},"id":"floe-email-drafting","notes":{"en":"Platform-metadata release only. The 1.0.1 archive is byte-identical to the reviewed 1.0.0 archive except the floe.json fields version (1.0.0 -> 1.0.1) and platforms ([ios] -> [ios, linux]), declaring the Linux compatibility environment of the Android shared skill runtime for unchanged guide content. Old archive sha256 fb57b71663f9f731e80592a586c76d8da1956b1f47d53cad1824182233c2de3a / contentDigest 579b8566ea929f48d898f38d00935beec3960ae0d1a07750da1585b5ff952723; new archive sha256 aaad0355c7a87966afb022148d31ba78c6d977033db258f63d183c75ecb96663 / contentDigest 639c1f39cad7bdefcfb6db6e9ae1266b53d468d244d9da3cee61e3d67b8b6bfe. Instructions, assets, licenses, capabilities, tools and dependencies are unchanged; the standing signed 1.0.0 static-content review remains the content review of record. This machine record is a platform declaration check only: not guest-verified, no execution claim, not full-App acceptance.","zh-Hans":"仅为平台元数据发布：1.0.1 归档与已评审的 1.0.0 归档逐字节一致，唯一差异是 floe.json 的 version（1.0.0 -> 1.0.1）与 platforms（[ios] -> [ios, linux]），用于让未改动的指南内容声明 Android 共享技能运行时所用的 Linux 兼容环境。旧归档 sha256 fb57b71663f9f731e80592a586c76d8da1956b1f47d53cad1824182233c2de3a / contentDigest 579b8566ea929f48d898f38d00935beec3960ae0d1a07750da1585b5ff952723；新归档 sha256 aaad0355c7a87966afb022148d31ba78c6d977033db258f63d183c75ecb96663 / contentDigest 639c1f39cad7bdefcfb6db6e9ae1266b53d468d244d9da3cee61e3d67b8b6bfe。指导内容、素材、许可、能力、工具与依赖均未变化；对有符号名 1.0.0 静态内容评审仍是内容评审记录。本机器记录仅校验平台声明：非来宾验证、无执行声明，也不是完整 App 验收。"},"packageSha256":"aaad0355c7a87966afb022148d31ba78c6d977033db258f63d183c75ecb96663","reviewStage":"static-content-reviewed","reviewedAt":"2026-10-28","reviewedCapabilities":[],"reviewedPythonPackages":[],"reviewedTools":[],"reviewer":"Floe Skill Hub static-compat (machine)","schemaVersion":1,"version":"1.0.1"}