{"contentDigest":"b3a3944f0e22768d140e8801b68fca36b7897305de1c9dc1fa28181159324ad7","decision":"approve","execution":{"arch":"riscv64","evidence":"guest-verified","os":"linux"},"id":"exploratory-data-analysis","notes":{"en":"Qualified in a real Linux/riscv64 guest using the declared NumPy and pandas layer: the complete verifier, file analysis and the pandas/stdlib cross-check passed. A separate import-denial run proved the required paths without unrelated union-installed modules. The exact Debian dependency declaration is pinned; tools and capabilities are unchanged. These are component CLI results, not per-skill native UI or physical-device acceptance.","zh-Hans":"已在真实Linux/riscv64客体中，使用声明的NumPy与pandas依赖完成完整验证器、文件分析及pandas/标准库交叉核验；单独的导入拒绝检查确认相关路径不依赖其他技能安装的额外模块。Debian依赖精确固定，工具与能力保持不变。此为组件CLI鉴定，不等于该技能逐项原生界面或真机验收。"},"packageSha256":"3ecb4b254cc361660ef1f3765d35ee90295420ea2fde3ae78de0cdb403e4140a","reviewStage":"guest-execution-qualified","reviewedAt":"2026-10-27","reviewedCapabilities":["execution.remote","workspace.read","workspace.write"],"reviewedPythonPackages":[{"capabilities":["data.numpy-containers"],"purpose":"Optional bounded NPY/NPZ inspector and numeric backend of the optional pandas profile path; identical to the Debian 13 guest package python3-numpy (1:2.2.4+ds) that the environment/package flow provisions","spec":"numpy==2.2.4"},{"capabilities":["data.pandas-tabular"],"purpose":"Optional pandas tabular profile path, validated separately from and cross-checked against the mandatory stdlib core; identical to the Debian 13 guest package python3-pandas (2.2.3+dfsg)","spec":"pandas==2.2.3"}],"reviewedTools":["exec.shell"],"reviewer":"Floe Skill Hub curation","schemaVersion":1,"version":"1.1.0"}