{"contentDigest":"cc7fb9632dd1b442857ceebe134850342252ba718e1438ce8bbe2d3227df6b58","decision":"approve","execution":{"arch":"n/a","evidence":"unproven","os":null},"id":"ui-design-system","notes":{"en":"Platform-metadata release only. The 1.0.1 archive is byte-identical to the reviewed 1.0.0 archive except the floe.json fields version (1.0.0 -> 1.0.1) and platforms ([ios] -> [ios, linux]), declaring the Linux compatibility environment of the Android shared skill runtime for unchanged guide content. Old archive sha256 a4bb99973f0de3f7fe175724d269a7a7cbbf4e239521052b33a54e5b75b70a6f / contentDigest f7af49f15ccf33b56cee5e712b9c3b6b15ecd36473ff1fee2549cc740a9a6321; new archive sha256 a9e2a56143f7c0e0218a2c9a5059b6d573d73d00847e3d360aab5696f804c1e6 / contentDigest cc7fb9632dd1b442857ceebe134850342252ba718e1438ce8bbe2d3227df6b58. Instructions, assets, licenses, capabilities, tools and dependencies are unchanged; the standing signed 1.0.0 static-content review remains the content review of record. This machine record is a platform declaration check only: not guest-verified, no execution claim, not full-App acceptance.","zh-Hans":"仅为平台元数据发布：1.0.1 归档与已评审的 1.0.0 归档逐字节一致，唯一差异是 floe.json 的 version（1.0.0 -> 1.0.1）与 platforms（[ios] -> [ios, linux]），用于让未改动的指南内容声明 Android 共享技能运行时所用的 Linux 兼容环境。旧归档 sha256 a4bb99973f0de3f7fe175724d269a7a7cbbf4e239521052b33a54e5b75b70a6f / contentDigest f7af49f15ccf33b56cee5e712b9c3b6b15ecd36473ff1fee2549cc740a9a6321；新归档 sha256 a9e2a56143f7c0e0218a2c9a5059b6d573d73d00847e3d360aab5696f804c1e6 / contentDigest cc7fb9632dd1b442857ceebe134850342252ba718e1438ce8bbe2d3227df6b58。指导内容、素材、许可、能力、工具与依赖均未变化；对有符号名 1.0.0 静态内容评审仍是内容评审记录。本机器记录仅校验平台声明：非来宾验证、无执行声明，也不是完整 App 验收。"},"packageSha256":"a9e2a56143f7c0e0218a2c9a5059b6d573d73d00847e3d360aab5696f804c1e6","reviewStage":"static-content-reviewed","reviewedAt":"2026-10-28","reviewedCapabilities":["workspace.read","workspace.write"],"reviewedPythonPackages":[],"reviewedTools":[],"reviewer":"Floe Skill Hub static-compat (machine)","schemaVersion":1,"version":"1.0.1"}