{"contentDigest":"1aa8e23c8c9a018e3b79381ac057963e5abec054614f686fe60f629cf3564c81","decision":"approve","execution":{"arch":"n/a","evidence":"unproven","os":null},"id":"test-driven-development","notes":{"en":"Platform-metadata release only. The 1.0.1 archive is byte-identical to the reviewed 1.0.0 archive except the floe.json fields version (1.0.0 -> 1.0.1) and platforms ([ios] -> [ios, linux]), declaring the Linux compatibility environment of the Android shared skill runtime for unchanged guide content. Old archive sha256 ca23bcd805acc2532b6bda73fa72156e912a805d99935e2d69bc7c13a40256d9 / contentDigest d79b1df0b795f80940f2b6b138410c3e5af7c6690514e109c95ffbd2741434a0; new archive sha256 7cbcd0a6a0f486175903bf114bd1a4dee0376f44aa623fb31b87e25eab4fc0dd / contentDigest 1aa8e23c8c9a018e3b79381ac057963e5abec054614f686fe60f629cf3564c81. Instructions, assets, licenses, capabilities, tools and dependencies are unchanged; the standing signed 1.0.0 static-content review remains the content review of record. This machine record is a platform declaration check only: not guest-verified, no execution claim, not full-App acceptance.","zh-Hans":"仅为平台元数据发布：1.0.1 归档与已评审的 1.0.0 归档逐字节一致，唯一差异是 floe.json 的 version（1.0.0 -> 1.0.1）与 platforms（[ios] -> [ios, linux]），用于让未改动的指南内容声明 Android 共享技能运行时所用的 Linux 兼容环境。旧归档 sha256 ca23bcd805acc2532b6bda73fa72156e912a805d99935e2d69bc7c13a40256d9 / contentDigest d79b1df0b795f80940f2b6b138410c3e5af7c6690514e109c95ffbd2741434a0；新归档 sha256 7cbcd0a6a0f486175903bf114bd1a4dee0376f44aa623fb31b87e25eab4fc0dd / contentDigest 1aa8e23c8c9a018e3b79381ac057963e5abec054614f686fe60f629cf3564c81。指导内容、素材、许可、能力、工具与依赖均未变化；对有符号名 1.0.0 静态内容评审仍是内容评审记录。本机器记录仅校验平台声明：非来宾验证、无执行声明，也不是完整 App 验收。"},"packageSha256":"7cbcd0a6a0f486175903bf114bd1a4dee0376f44aa623fb31b87e25eab4fc0dd","reviewStage":"static-content-reviewed","reviewedAt":"2026-10-28","reviewedCapabilities":["workspace.read"],"reviewedPythonPackages":[],"reviewedTools":[],"reviewer":"Floe Skill Hub static-compat (machine)","schemaVersion":1,"version":"1.0.1"}