{"contentDigest":"31a7dac51bb8ab1961c80ee48d96833cca07c774cf6e7d61eeb18a999ac1ffeb","decision":"approve","execution":{"arch":"riscv64","evidence":"unproven","os":"linux"},"id":"canvas-design","notes":{"en":"Static content review only. SKILL.md, bundled scripts (python3 stdlib only), bundled SIL-OFL-1.1 fonts with per-font license texts and license notices reviewed against the manifest: declared capabilities execution.remote/workspace.read/workspace.write and required tool exec.shell match shipped content; no python dependencies declared and none imported; raster/PDF deliverables route through the app's own browser capture surfaces and the bundled containerizer, with unrendered output never claimed. No self-granted trust, no unlisted-skill fetch, no install-time privilege. Guest execution remains UNPROVEN (Main-owned); this is not runtime qualification or App acceptance.","zh-Hans":"仅静态内容审核。已按清单核对 SKILL.md、随附脚本（仅 python3 stdlib）、随附 SIL-OFL-1.1 字体（含每字体许可文本）与许可声明：声明能力 execution.remote/workspace.read/workspace.write 与必需工具 exec.shell 和实际内容一致；未声明也未导入任何 python 依赖；光栅/PDF 交付经应用自有浏览器采集面与随附封装器，未渲染产物绝不声称完成。无自我授权信任、无拉取未列名 Skill、无安装时特权。来宾执行仍为未证实（Main 负责）；此非运行时鉴定或 App 验收。"},"packageSha256":"0b52ea004b75d8ba7575c54307dac5b76122d2ad2be7d710a61ff4fc2f55153d","reviewStage":"static-content-reviewed","reviewedAt":"2026-10-26","reviewedCapabilities":["execution.remote","workspace.read","workspace.write"],"reviewedPythonPackages":[],"reviewedTools":["exec.shell"],"reviewer":"Floe Skill Hub curation","schemaVersion":1,"version":"1.0.0"}