{"contentDigest":"c21bc8f6c2e790e6d726bd91269d4878931f3d6f4a7edbd002b9f1ad300e5bbf","decision":"approve","execution":{"arch":"n/a","evidence":"unproven","os":null},"id":"floe-file-organizer","notes":{"en":"Platform-metadata release only. The 1.0.1 archive is byte-identical to the reviewed 1.0.0 archive except the floe.json fields version (1.0.0 -> 1.0.1) and platforms ([ios] -> [ios, linux]), declaring the Linux compatibility environment of the Android shared skill runtime for unchanged guide content. Old archive sha256 146e5e057b203d6ebfc8f289b514ab0b59a63670803d8e7e5d5915135e88f0b4 / contentDigest 0f38fa3a56c9ab6685efef4d5e8c4b819d9a84267d4047302469bbcb8ad899d2; new archive sha256 e01ea895cfa547da8bb5dd21583da1fc2561b99a5facec61a9967500881f48c9 / contentDigest c21bc8f6c2e790e6d726bd91269d4878931f3d6f4a7edbd002b9f1ad300e5bbf. Instructions, assets, licenses, capabilities, tools and dependencies are unchanged; the standing signed 1.0.0 static-content review remains the content review of record. This machine record is a platform declaration check only: not guest-verified, no execution claim, not full-App acceptance.","zh-Hans":"仅为平台元数据发布：1.0.1 归档与已评审的 1.0.0 归档逐字节一致，唯一差异是 floe.json 的 version（1.0.0 -> 1.0.1）与 platforms（[ios] -> [ios, linux]），用于让未改动的指南内容声明 Android 共享技能运行时所用的 Linux 兼容环境。旧归档 sha256 146e5e057b203d6ebfc8f289b514ab0b59a63670803d8e7e5d5915135e88f0b4 / contentDigest 0f38fa3a56c9ab6685efef4d5e8c4b819d9a84267d4047302469bbcb8ad899d2；新归档 sha256 e01ea895cfa547da8bb5dd21583da1fc2561b99a5facec61a9967500881f48c9 / contentDigest c21bc8f6c2e790e6d726bd91269d4878931f3d6f4a7edbd002b9f1ad300e5bbf。指导内容、素材、许可、能力、工具与依赖均未变化；对有符号名 1.0.0 静态内容评审仍是内容评审记录。本机器记录仅校验平台声明：非来宾验证、无执行声明，也不是完整 App 验收。"},"packageSha256":"e01ea895cfa547da8bb5dd21583da1fc2561b99a5facec61a9967500881f48c9","reviewStage":"static-content-reviewed","reviewedAt":"2026-10-28","reviewedCapabilities":["workspace.delete","workspace.read","workspace.write"],"reviewedPythonPackages":[],"reviewedTools":[],"reviewer":"Floe Skill Hub static-compat (machine)","schemaVersion":1,"version":"1.0.1"}