{"contentDigest":"c8915be31ea1aef72ddc3d361def6269bc1981144c7f55aa73d8c74d51edf857","decision":"approve","execution":{"arch":"riscv64","evidence":"unproven","os":"linux"},"id":"markitdown","notes":{"en":"Static content review only. SKILL.md, bundled scripts and license notices reviewed against the manifest: declared capabilities execution.remote/workspace.read/workspace.write and required tool exec.shell match shipped content; the Microsoft MarkItDown package is explicitly NOT bundled; guest extractors use only the declared pins openpyxl==3.1.5 and pdfminer.six==20221105 plus stdlib; native routes are optional task capabilities discovered via tools.search and add no authority; encrypted PDFs and scans fail closed with native-routing receipts. No self-granted trust, no unlisted-skill fetch, no install-time privilege. Guest execution remains UNPROVEN (Main-owned); this is not runtime qualification or App acceptance.","zh-Hans":"仅静态内容审核。已按清单核对 SKILL.md、随附脚本与许可声明：声明能力 execution.remote/workspace.read/workspace.write 与必需工具 exec.shell 和实际内容一致；Microsoft MarkItDown 包明确未随附；来宾提取器仅使用声明 pin（openpyxl==3.1.5、pdfminer.six==20221105）与 stdlib；原生路线为可选任务能力，经 tools.search 发现且不增加权限；加密 PDF 与扫描件闭式失败并给出原生路由回执。无自我授权信任、无拉取未列名 Skill、无安装时特权。来宾执行仍为未证实（Main 负责）；此非运行时鉴定或 App 验收。"},"packageSha256":"bd95560d5590d92b105fb07136b775923c4f25245b9d1ae3556cfdbbaab1db1b","reviewStage":"static-content-reviewed","reviewedAt":"2026-10-26","reviewedCapabilities":["execution.remote","workspace.read","workspace.write"],"reviewedPythonPackages":[{"capabilities":["documents.xlsx-extraction"],"purpose":"XLSX workbook -> Markdown table extraction (read-only, bounded, cached formula values only); identical to Debian 13 guest package python3-openpyxl (3.1.5+dfsg)","spec":"openpyxl==3.1.5"},{"capabilities":["documents.pdf-text-extraction"],"purpose":"Extractable-text PDF -> Markdown for bounded in-guest/batch workflows; encrypted PDFs are refused and routed to the native PDFKit flow; identical to Debian 13 guest package python3-pdfminer (20221105+dfsg)","spec":"pdfminer.six==20221105"}],"reviewedTools":["exec.shell"],"reviewer":"Floe Skill Hub curation","schemaVersion":1,"version":"1.0.0"}