{"contentDigest":"ce000d16cf03e3696c75b329ab2e2f4ce02319cb5645ad7d5917c889845e0fbc","decision":"approve","execution":{"arch":"n/a","evidence":"unproven","os":null},"id":"internal-comms","notes":{"en":"Platform-metadata release only. The 1.0.1 archive is byte-identical to the reviewed 1.0.0 archive except the floe.json fields version (1.0.0 -> 1.0.1) and platforms ([ios] -> [ios, linux]), declaring the Linux compatibility environment of the Android shared skill runtime for unchanged guide content. Old archive sha256 9653cf16a282776e61af910272d947d29fe23fd01fa0615c06423ce12394d3e2 / contentDigest 697e3e2ef4edcfcae0970f6f985658fe5e1c0d6754f1b6d92795ec6b83302a78; new archive sha256 a3b578e9fc06fa4627ecded3540b929b681207867398ed7983b966d30505c725 / contentDigest ce000d16cf03e3696c75b329ab2e2f4ce02319cb5645ad7d5917c889845e0fbc. Instructions, assets, licenses, capabilities, tools and dependencies are unchanged; the standing signed 1.0.0 static-content review remains the content review of record. This machine record is a platform declaration check only: not guest-verified, no execution claim, not full-App acceptance.","zh-Hans":"仅为平台元数据发布：1.0.1 归档与已评审的 1.0.0 归档逐字节一致，唯一差异是 floe.json 的 version（1.0.0 -> 1.0.1）与 platforms（[ios] -> [ios, linux]），用于让未改动的指南内容声明 Android 共享技能运行时所用的 Linux 兼容环境。旧归档 sha256 9653cf16a282776e61af910272d947d29fe23fd01fa0615c06423ce12394d3e2 / contentDigest 697e3e2ef4edcfcae0970f6f985658fe5e1c0d6754f1b6d92795ec6b83302a78；新归档 sha256 a3b578e9fc06fa4627ecded3540b929b681207867398ed7983b966d30505c725 / contentDigest ce000d16cf03e3696c75b329ab2e2f4ce02319cb5645ad7d5917c889845e0fbc。指导内容、素材、许可、能力、工具与依赖均未变化；对有符号名 1.0.0 静态内容评审仍是内容评审记录。本机器记录仅校验平台声明：非来宾验证、无执行声明，也不是完整 App 验收。"},"packageSha256":"a3b578e9fc06fa4627ecded3540b929b681207867398ed7983b966d30505c725","reviewStage":"static-content-reviewed","reviewedAt":"2026-10-28","reviewedCapabilities":["workspace.read","workspace.write"],"reviewedPythonPackages":[],"reviewedTools":[],"reviewer":"Floe Skill Hub static-compat (machine)","schemaVersion":1,"version":"1.0.1"}